{
  "$schema": "http://json-schema.org/draft-07/schema#",
  "title": "free-for-creators category file",
  "description": "Schema for data/<slug>.json. Editor aid — authoritative validation lives in scripts/build_readme.py.",
  "type": "object",
  "required": ["category", "slug", "description", "entries"],
  "additionalProperties": false,
  "properties": {
    "category": {
      "type": "string",
      "description": "Human-readable category name, used as the README heading."
    },
    "category_zh": {
      "type": "string",
      "description": "Chinese category name, used as the README.zh-CN.md heading."
    },
    "slug": {
      "type": "string",
      "pattern": "^[a-z0-9]+(-[a-z0-9]+)*$",
      "description": "Must match the filename: data/<slug>.json"
    },
    "description": {
      "type": "string",
      "description": "One-line description of the category."
    },
    "description_zh": {
      "type": "string",
      "description": "Chinese one-line description of the category."
    },
    "entries": {
      "type": "array",
      "minItems": 1,
      "items": { "$ref": "#/definitions/entry" }
    }
  },
  "definitions": {
    "entry": {
      "type": "object",
      "required": ["name", "url", "description", "license", "license_family", "attribution", "monetization"],
      "additionalProperties": false,
      "properties": {
        "name": { "type": "string", "minLength": 1 },
        "url": {
          "type": "string",
          "pattern": "^https://",
          "description": "Canonical landing page. HTTPS only, no affiliate or tracking params, no URL shorteners."
        },
        "description": {
          "type": "string",
          "maxLength": 160,
          "description": "What it is, in one line. No pipe characters."
        },
        "description_zh": {
          "type": "string",
          "maxLength": 160,
          "description": "Chinese description. Optional — the zh README falls back to English."
        },
        "license": {
          "type": "string",
          "description": "License name as the source states it, e.g. 'CC0', 'Pixabay Content License', 'Various (per item)'. Free text — for filtering use license_family."
        },
        "license_family": {
          "enum": ["cc0", "permissive", "cc-by", "site-free", "mixed", "noncommercial"],
          "description": "Controlled class of the license, used for stats and the site's CC0 filter. cc0 = CC0/public domain only, no conditions. permissive = OSS licenses (MIT/Apache/OFL/ISC/UFL). cc-by = Creative Commons attribution/share-alike. site-free = the site's own free license (attribution column says whether credit is needed). mixed = terms differ per item, or are not uniformly known. noncommercial = not free for commercial/monetized use."
        },
        "contains_cc0": {
          "type": "boolean",
          "description": "Only with license_family 'mixed': the site does host CC0/public-domain items, but they must be filtered per asset. Set true so the CC0 filter still surfaces it."
        },
        "attribution": {
          "enum": ["required", "not-required", "varies"],
          "description": "Is credit/attribution mandatory for free use?"
        },
        "monetization": {
          "enum": ["allowed", "conditional", "varies", "not-allowed"],
          "description": "Can it be used in monetized/commercial content for free?"
        },
        "signup": {
          "enum": ["required", "not-required", "optional", "unknown"],
          "description": "Is an account needed to download?"
        },
        "notes": {
          "type": "string",
          "maxLength": 200,
          "description": "Optional caveats shown in italics after the description. Bounded so a note stays a caveat rather than becoming a terms-of-service digest; the longest in the data is 174."
        },
        "notes_zh": {
          "type": "string",
          "maxLength": 200,
          "description": "Chinese caveats. Optional — the zh README falls back to English."
        },
        "submitted_by": {
          "type": "string",
          "pattern": "^[A-Za-z0-9][A-Za-z0-9-]*$",
          "description": "GitHub username of the person who suggested this entry. Rendered as a credit under Contributors and beside the entry."
        },
        "skip_linkcheck": {
          "type": "boolean",
          "description": "Set true only when CI cannot check the URL (e.g. login walls). Justify in the PR."
        },
        "linkcheck_js": {
          "type": "boolean",
          "description": "Set true when the page is a JavaScript app whose HTML contains no <title>/<h1>, so scripts/linkcheck.py cannot confirm content from a plain fetch and would otherwise report it as needing a manual check. The URL is still checked for status, redirects and soft-404s."
        },
        "license_checked": {
          "type": "string",
          "pattern": "^[0-9]{4}-[0-9]{2}-[0-9]{2}$",
          "description": "YYYY-MM-DD this entry's licence wording was last read at its source. The weekly link check proves a URL resolves; only a human reading the page proves the licence still says what the entry claims. Optional because the entries that predate the field have no honest date to carry — scripts/check_entry.py --license-audit lists them as a backlog."
        },
        "license_source": {
          "type": "string",
          "pattern": "^https://",
          "description": "The page the licence wording was read at — the site's terms page, or a repository LICENSE file. Required whenever license_checked is set, so every date can be traced back to what was read."
        }
      }
    }
  }
}
