{
  "category": "Video Production",
  "category_zh": "视频制作",
  "slug": "video-production",
  "description": "LUTs, color grading assets, transitions and editor templates.",
  "description_zh": "LUT、调色资产、转场与剪辑软件模板。",
  "entries": [
    {
      "name": "IWLTBAP Free LUTs",
      "url": "https://iwltbap.com/free-luts/",
      "description": "Free filmic LUTs from a well-known color grading shop.",
      "description_zh": "知名调色商店的免费电影感 LUT。",
      "license": "Free (IWLTBAP)",
      "license_family": "site-free",
      "attribution": "not-required",
      "monetization": "allowed",
      "signup": "required"
    },
    {
      "name": "FreshLuts",
      "url": "https://freshluts.com/",
      "description": "Community site for sharing and downloading free LUTs.",
      "description_zh": "社区分享与下载免费 LUT 的站点。",
      "license": "Various (community uploads)",
      "license_family": "mixed",
      "attribution": "varies",
      "monetization": "allowed",
      "signup": "not-required",
      "notes": "Community uploads: check the usage rights of each LUT.",
      "notes_zh": "社区上传：请逐个核对使用权限。"
    },
    {
      "name": "Fujifilm Camera Profiles",
      "url": "https://github.com/abpy/FujifilmCameraProfiles",
      "description": "Open DNG/DCP profiles and LUTs matching Fujifilm film simulations.",
      "description_zh": "匹配富士胶片模拟的开放 DNG/DCP 配置与 LUT。",
      "license": "Open (see repository)",
      "license_family": "site-free",
      "attribution": "not-required",
      "monetization": "allowed",
      "signup": "not-required"
    },
    {
      "name": "Mixkit Templates",
      "url": "https://mixkit.co/free-after-effects-templates/",
      "description": "Free After Effects, Premiere, DaVinci and Final Cut templates and transitions.",
      "description_zh": "免费的 AE、Premiere、DaVinci 与 Final Cut 模板与转场。",
      "license": "Mixkit License",
      "license_family": "site-free",
      "attribution": "not-required",
      "monetization": "allowed",
      "signup": "not-required"
    },
    {
      "name": "Motion Array",
      "url": "https://motionarray.com/",
      "description": "Free templates, LUTs and presets section of a premium marketplace.",
      "description_zh": "高端市场的免费模板、LUT 与预设专区。",
      "license": "Motion Array royalty-free license",
      "license_family": "site-free",
      "attribution": "not-required",
      "monetization": "allowed",
      "signup": "required",
      "notes": "Free assets sit behind the on-site Free filter plus a free account; the free plan caps monthly downloads.",
      "notes_zh": "免费素材需通过站内 Free 筛选并登录免费账号获取；免费版每月下载有额度上限。"
    },
    {
      "name": "Velosofy",
      "url": "https://www.velosofy.com/",
      "description": "Community library of free video templates (AE, Premiere, Sony Vegas).",
      "description_zh": "社区免费视频模板库（AE、Premiere、Vegas）。",
      "license": "Various (per template)",
      "license_family": "mixed",
      "attribution": "varies",
      "monetization": "varies",
      "signup": "optional"
    },
    {
      "name": "FootageCrate",
      "url": "https://footagecrate.com/",
      "description": "Free VFX elements, overlays and action footage from ProductionCrew.",
      "description_zh": "ProductionCrew 出品的免费 VFX 元素、叠加特效与动作素材。",
      "license": "FootageCrate Free License",
      "license_family": "site-free",
      "attribution": "not-required",
      "monetization": "conditional",
      "signup": "required",
      "notes": "Free tier: 5 downloads/day; commercial use allowed within limits.",
      "notes_zh": "免费档每日 5 次下载；限额内可商用。"
    },
    {
      "name": "MotionElements",
      "url": "https://www.motionelements.com/free/stock-footage",
      "description": "Marketplace with a rotating free section: templates, SFX, video.",
      "description_zh": "素材市场，每周轮换免费专区：模板、音效、视频。",
      "license": "MotionElements Free License",
      "license_family": "site-free",
      "attribution": "not-required",
      "monetization": "varies",
      "signup": "required",
      "notes": "Free items rotate weekly; check the license per item.",
      "notes_zh": "免费条目每周轮换，逐项核对许可。"
    },
    {
      "name": "Envato Free Files",
      "url": "https://elements.envato.com/free-files",
      "description": "Rotating monthly free assets from Envato Elements: templates, video, audio, fonts.",
      "description_zh": "Envato Elements 每月轮换免费素材：模板、视频、音频、字体。",
      "license": "Envato free-file license",
      "license_family": "site-free",
      "attribution": "not-required",
      "monetization": "allowed",
      "signup": "required",
      "notes": "Each month's free files carry the standard Envato license; check the download page.",
      "notes_zh": "每月免费文件采用 Envato 标准许可；以下载页为准。"
    },
    {
      "name": "LUTify.me Free LUTs",
      "url": "https://lutify.me/free-luts/",
      "description": "Free scene-referred LUTs from a commercial LUT maker, released under CC BY-SA 4.0.",
      "description_zh": "商业 LUT 厂商提供的免费场景参照 LUT，采用 CC BY-SA 4.0 发布。",
      "license": "CC BY-SA 4.0 (free downloads)",
      "license_family": "cc-by",
      "attribution": "required",
      "monetization": "allowed",
      "signup": "required",
      "notes": "CC BY-SA: credit is required and derivatives must carry the same licence. Downloads go through a free fylm.ai Lite account.",
      "notes_zh": "CC BY-SA：需署名，且演绎作品须沿用同一许可。下载需注册免费的 fylm.ai Lite 账号。"
    }
  ]
}
