{
  "category": "Fonts",
  "category_zh": "字体",
  "slug": "fonts",
  "description": "Typefaces free for commercial use, including CJK families.",
  "description_zh": "可免费商用的字体，含中日韩字体家族。",
  "entries": [
    {
      "name": "Google Fonts",
      "url": "https://fonts.google.com/",
      "description": "1,700+ families, almost all under open licenses.",
      "description_zh": "1,700+ 字体家族，几乎全部采用开放许可。",
      "license": "OFL / Apache 2.0 / UFL (per family)",
      "license_family": "mixed",
      "attribution": "not-required",
      "monetization": "allowed",
      "signup": "not-required",
      "linkcheck_js": true
    },
    {
      "name": "Fontshare",
      "url": "https://www.fontshare.com/",
      "description": "Professional-quality free fonts from the Indian Type Foundry.",
      "description_zh": "Indian Type Foundry 出品的专业级免费字体。",
      "license": "ITF Free Font License",
      "license_family": "site-free",
      "attribution": "not-required",
      "monetization": "allowed",
      "signup": "not-required",
      "linkcheck_js": true
    },
    {
      "name": "Bunny Fonts",
      "url": "https://fonts.bunny.net/",
      "description": "Privacy-friendly, all-OFL drop-in replacement for Google Fonts.",
      "description_zh": "隐私友好、全 OFL 许可，可直接替换 Google Fonts。",
      "license": "OFL",
      "license_family": "permissive",
      "attribution": "not-required",
      "monetization": "allowed",
      "signup": "not-required"
    },
    {
      "name": "Font Squirrel",
      "url": "https://www.fontsquirrel.com/",
      "description": "Hand-vetted fonts that are 100% free for commercial use.",
      "description_zh": "人工审核、100% 可免费商用的字体。",
      "license": "Various free licenses",
      "license_family": "mixed",
      "attribution": "not-required",
      "monetization": "allowed",
      "signup": "not-required"
    },
    {
      "name": "The League of Moveable Type",
      "url": "https://www.theleagueofmoveabletype.com/",
      "description": "The original open-source type foundry.",
      "description_zh": "最早的开源字体铸造厂。",
      "license": "OFL",
      "license_family": "permissive",
      "attribution": "not-required",
      "monetization": "allowed",
      "signup": "not-required"
    },
    {
      "name": "Velvetyne",
      "url": "https://velvetyne.fr/",
      "description": "Experimental and quirky free open-source typefaces.",
      "description_zh": "实验性、风格独特的免费开源字体。",
      "license": "OFL / custom open licenses",
      "license_family": "permissive",
      "attribution": "not-required",
      "monetization": "allowed",
      "signup": "not-required"
    },
    {
      "name": "Font Library",
      "url": "https://fontlibrary.org/",
      "description": "Community catalog of libre typefaces.",
      "description_zh": "社区维护的自由字体目录。",
      "license": "OFL / CC (per family)",
      "license_family": "mixed",
      "attribution": "varies",
      "monetization": "allowed",
      "signup": "not-required"
    },
    {
      "name": "DaFont",
      "url": "https://www.dafont.com/",
      "description": "Catalog of user-submitted fonts; many are demo or personal-use only.",
      "description_zh": "超大字体目录；许多字体仅限演示或个人使用。",
      "license": "Various (per font)",
      "license_family": "mixed",
      "attribution": "varies",
      "monetization": "varies",
      "signup": "not-required",
      "notes": "Always check the per-font license file before commercial use.",
      "notes_zh": "商用前务必逐字核对许可文件。"
    },
    {
      "name": "1001 Fonts",
      "url": "https://www.1001fonts.com/",
      "description": "10,000+ fonts with license filtering.",
      "description_zh": "10,000+ 字体，支持按许可筛选。",
      "license": "Various (per font)",
      "license_family": "mixed",
      "attribution": "varies",
      "monetization": "varies",
      "signup": "not-required"
    },
    {
      "name": "free-font (CJK)",
      "url": "https://github.com/jaywcjlove/free-font",
      "description": "Chinese-language list of fonts free for commercial use.",
      "description_zh": "中英文可商用免费字体清单。",
      "license": "Various (per font)",
      "license_family": "mixed",
      "attribution": "varies",
      "monetization": "varies",
      "signup": "not-required",
      "notes": "Chinese-language list; mostly OFL, but a few fonts are personal-use-only, CC BY-NC or need authorization — check each font's license tag.",
      "notes_zh": "绝大多数为 OFL 等开源许可，但少数字体标记为「个人免费」「个人非商业」「CC BY-NC」或「需要授权」——商用前请逐个核对许可标签。"
    },
    {
      "name": "Use & Modify",
      "url": "https://usemodify.com/",
      "description": "Catalog of free fonts by a Swiss designer, with filters.",
      "description_zh": "瑞士设计师整理的可商用免费字体目录，支持筛选。",
      "license": "OFL / open licenses (per family)",
      "license_family": "mixed",
      "attribution": "not-required",
      "monetization": "allowed",
      "signup": "not-required"
    },
    {
      "name": "Open Foundry",
      "url": "https://open-foundry.com/",
      "description": "Platform for open-licensed typefaces with showcase projects.",
      "description_zh": "开放许可字体平台，附展示项目。",
      "license": "Various open licenses (per font)",
      "license_family": "mixed",
      "attribution": "varies",
      "monetization": "varies",
      "signup": "not-required",
      "notes": "Site FAQ: commercial use depends on each font's own licence and some have restrictions — read it before client work.",
      "notes_zh": "官网 FAQ：能否商用取决于每个字体自身的许可，部分许可存在限制——用于客户项目前请先阅读该字体许可。"
    },
    {
      "name": "Source Han Sans (思源黑体)",
      "url": "https://github.com/adobe-fonts/source-han-sans",
      "description": "Adobe and Google's open-source CJK sans family, with seven weights per language region.",
      "description_zh": "Adobe 与 Google 联合开源的中日韩黑体家族，每个语言区域七个字重。",
      "license": "SIL Open Font License 1.1",
      "license_family": "permissive",
      "attribution": "not-required",
      "monetization": "allowed",
      "signup": "not-required"
    },
    {
      "name": "Source Han Serif (思源宋体)",
      "url": "https://github.com/adobe-fonts/source-han-serif",
      "description": "The serif companion to Source Han Sans for CJK body text, editorial and print work.",
      "description_zh": "思源黑体的宋体姊妹作，适用于中日韩正文、刊物与印刷排版。",
      "license": "SIL Open Font License 1.1",
      "license_family": "permissive",
      "attribution": "not-required",
      "monetization": "allowed",
      "signup": "not-required"
    },
    {
      "name": "Sarasa Gothic (更纱黑体)",
      "url": "https://github.com/be5invis/Sarasa-Gothic",
      "description": "Source Han Sans merged with Iosevka to give CJK text fixed-width alignment in code and terminals.",
      "description_zh": "将思源黑体与 Iosevka 合并，使中日韩文字在代码与终端中等宽对齐。",
      "license": "SIL Open Font License 1.1",
      "license_family": "permissive",
      "attribution": "not-required",
      "monetization": "allowed",
      "signup": "not-required"
    },
    {
      "name": "Smiley Sans (得意黑)",
      "url": "https://atelier-anchor.com/typefaces/smiley-sans",
      "description": "Open-source condensed Chinese display face from atelier Anchor, made for headlines and posters.",
      "description_zh": "atelier Anchor 开源的中文窄斜标题黑体，适用于大标题与海报。",
      "license": "SIL Open Font License 1.1",
      "license_family": "permissive",
      "attribution": "not-required",
      "monetization": "allowed",
      "signup": "not-required"
    },
    {
      "name": "LXGW WenKai (霞鹜文楷)",
      "url": "https://github.com/lxgw/LxgwWenKai",
      "description": "Open-source Chinese kai family derived from Klee One, suited to reading, subtitles and quotes.",
      "description_zh": "基于 Klee One 的开源中文楷体家族，适合阅读、字幕与引文排版。",
      "license": "SIL Open Font License 1.1",
      "license_family": "permissive",
      "attribution": "not-required",
      "monetization": "allowed",
      "signup": "not-required"
    },
    {
      "name": "Alibaba PuHuiTi (阿里巴巴普惠体)",
      "url": "https://www.alibabafonts.com/",
      "description": "Alibaba's Chinese text family with commercial rights opened to individuals and businesses.",
      "description_zh": "阿里巴巴开放商业授权给个人与商家的中文字体家族。",
      "license": "Alibaba PuHuiTi License (free commercial use)",
      "license_family": "site-free",
      "attribution": "not-required",
      "monetization": "allowed",
      "signup": "required",
      "notes": "Vendor opens commercial use to all individuals and merchants; the full agreement was unreachable, so verify before redistributing.",
      "notes_zh": "官网声明向所有个人和商家开放商用；完整协议本次未能抓取，再分发前请自行核对。"
    },
    {
      "name": "MiSans",
      "url": "https://hyperos.mi.com/font/",
      "description": "Xiaomi's MiSans typeface family covering Chinese, Latin and more; free for commercial use.",
      "description_zh": "小米 MiSans 字体家族，覆盖中文、拉丁等多语言；官方声明全球免费商用。",
      "license": "MiSans Font License (free commercial use)",
      "license_family": "site-free",
      "attribution": "not-required",
      "monetization": "allowed",
      "signup": "not-required",
      "notes": "Official page states global free commercial use; no attribution required.",
      "notes_zh": "官方页面标注全球免费商用，无需署名。"
    },
    {
      "name": "Fontsource",
      "url": "https://fontsource.org/",
      "description": "Self-host open-source fonts as npm packages or CDN files; 2,000+ families.",
      "description_zh": "以 npm 包或 CDN 文件自托管开源字体，覆盖 2000+ 字体家族。",
      "license": "OFL / Apache / MIT (per family); tooling under MIT",
      "license_family": "mixed",
      "attribution": "varies",
      "monetization": "allowed",
      "signup": "not-required",
      "notes": "Font licenses follow each family (mostly OFL); the platform itself is MIT, and files are self-hosted.",
      "notes_zh": "字体许可随各家族（多为 OFL）；平台本身为 MIT，文件自托管。"
    }
  ]
}
