{
  "category": "Sound Effects",
  "category_zh": "音效",
  "slug": "sound-effects",
  "description": "Free SFX libraries, packs and ambience for video, games, podcasts and streams.",
  "description_zh": "面向视频、游戏、播客与直播的免费音效库、音效包与氛围音。",
  "entries": [
    {
      "name": "Freesound",
      "url": "https://freesound.org/",
      "description": "Collaborative database of sounds under CC0 and CC-BY licenses.",
      "description_zh": "以 CC0 与 CC-BY 许可为主的大型协作声音数据库。",
      "license": "Various CC licenses (per sound)",
      "license_family": "mixed",
      "contains_cc0": true,
      "attribution": "varies",
      "monetization": "varies",
      "signup": "required",
      "notes": "Filter by license; CC-BY sounds need credit in your description.",
      "notes_zh": "按许可证筛选；CC-BY 声音需在简介中署名。"
    },
    {
      "name": "ZapSplat",
      "url": "https://www.zapsplat.com/",
      "description": "100,000+ free sound effects; free tier works with attribution.",
      "description_zh": "10 万+ 免费音效；免费档需署名。",
      "license": "ZapSplat Free License",
      "license_family": "site-free",
      "attribution": "required",
      "monetization": "conditional",
      "signup": "required",
      "notes": "Gold membership removes attribution and raises quality limits.",
      "notes_zh": "Gold 会员可免署名并提高下载质量上限。"
    },
    {
      "name": "Pixabay Sound Effects",
      "url": "https://pixabay.com/sound-effects/",
      "description": "Royalty-free sound effects library from Pixabay.",
      "description_zh": "Pixabay 的免版税音效库。",
      "license": "Pixabay Content License",
      "license_family": "site-free",
      "attribution": "not-required",
      "monetization": "allowed",
      "signup": "not-required"
    },
    {
      "name": "Mixkit Sound Effects",
      "url": "https://mixkit.co/free-sound-effects/",
      "description": "Free SFX for videos, games and streams from Envato's Mixkit.",
      "description_zh": "Envato Mixkit 的免费音效，适用于视频、游戏与直播。",
      "license": "Mixkit Sound Effects Free License",
      "license_family": "site-free",
      "attribution": "not-required",
      "monetization": "allowed",
      "signup": "not-required"
    },
    {
      "name": "BBC Sound Effects",
      "url": "https://sound-effects.bbcrewind.co.uk/",
      "description": "33,000+ sounds from the historic BBC archive.",
      "description_zh": "BBC 历史档案中的 33,000+ 声音。",
      "license": "RemArc/BBC License (personal, educational, research only)",
      "license_family": "noncommercial",
      "attribution": "not-required",
      "monetization": "not-allowed",
      "signup": "not-required",
      "notes": "NOT free for commercial or monetized content; great for learning and research.",
      "notes_zh": "不可用于商业或已货币化内容；适合学习与研究。"
    },
    {
      "name": "Sonniss GDC Audio Bundles",
      "url": "https://sonniss.com/gameaudiogdc",
      "description": "Multi-gigabyte professional game audio packs released free every year.",
      "description_zh": "每年免费发放的数 GB 专业游戏音频包。",
      "license": "Royalty-free (Sonniss GDC license)",
      "license_family": "site-free",
      "attribution": "not-required",
      "monetization": "allowed",
      "signup": "not-required"
    },
    {
      "name": "Orange Free Sounds",
      "url": "https://orangefreesounds.com/",
      "description": "Large mixed library of free sounds, loops and ringtones.",
      "description_zh": "大型混合免费声音、循环与铃声库。",
      "license": "Various CC licenses",
      "license_family": "mixed",
      "attribution": "varies",
      "monetization": "varies",
      "signup": "not-required"
    },
    {
      "name": "SoundBible",
      "url": "https://soundbible.com/",
      "description": "Simple, no-frills free sound effect downloads.",
      "description_zh": "简单直接的免费音效下载站。",
      "license": "CC0 / CC-BY (per sound)",
      "license_family": "mixed",
      "contains_cc0": true,
      "attribution": "varies",
      "monetization": "varies",
      "signup": "not-required"
    },
    {
      "name": "Freesfx.co.uk",
      "url": "https://www.freesfx.co.uk/",
      "description": "Free sound effects usable with a credit.",
      "description_zh": "免费音效，使用时需署名。",
      "license": "freesfx.co.uk License",
      "license_family": "site-free",
      "attribution": "required",
      "monetization": "conditional",
      "signup": "not-required",
      "notes": "Free for commercial and broadcast use, but the credit must include the freesfx.co.uk URL.",
      "notes_zh": "可用于商业与广播制作，但署名中必须包含 freesfx.co.uk 网址。"
    },
    {
      "name": "Kenney Audio",
      "url": "https://kenney.nl/assets?type=audio",
      "description": "CC0 audio packs (UI, sci-fi, RPG) from the prolific Kenney library.",
      "description_zh": "高产素材库 Kenney 的 CC0 音频包（UI、科幻、RPG）。",
      "license": "CC0",
      "license_family": "cc0",
      "attribution": "not-required",
      "monetization": "allowed",
      "signup": "not-required"
    },
    {
      "name": "Tabletop Audio",
      "url": "https://tabletopaudio.com/",
      "description": "Ambience loops for tabletop RPG sessions, streams and podcasts.",
      "description_zh": "适合跑团、直播与播客的氛围循环音。",
      "license": "CC BY-NC-ND 4.0",
      "license_family": "noncommercial",
      "attribution": "required",
      "monetization": "not-allowed",
      "signup": "not-required",
      "notes": "NonCommercial only: fine for personal and non-monetized use.",
      "notes_zh": "仅限非商业：可用于个人及未货币化内容。"
    },
    {
      "name": "SFXMint",
      "url": "https://sfxmint.com/",
      "description": "Free CC0 game and UI sound effects in WAV/MP3; AI-generated or procedurally synthesized.",
      "description_zh": "免费 CC0 游戏与 UI 音效库，提供 WAV/MP3 下载；素材由 AI 生成或程序合成。",
      "license": "CC0",
      "license_family": "cc0",
      "attribution": "not-required",
      "monetization": "allowed",
      "signup": "not-required",
      "notes": "Library sounds are CC0; the separate AI generation feature has its own pricing — preview sounds before shipping.",
      "notes_zh": "站内音效素材均为 CC0；独立的 AI 生成功能另行计费——发布前请先试听确认。"
    },
    {
      "name": "Soundza",
      "url": "https://soundza.com/",
      "description": "Free royalty-free sound effects, music loops and ambience in WAV/MP3; no attribution, commercial use allowed.",
      "description_zh": "免费音效、音乐循环与环境音库（WAV/MP3）；免署名、可商用。",
      "license": "Soundza Standard License",
      "attribution": "not-required",
      "monetization": "allowed",
      "signup": "required",
      "notes": "Downloads need a free account after the first three. May not redistribute sounds as standalone files, resell them, or use them to train AI models.",
      "notes_zh": "前 3 个下载免注册，之后需免费账号；不得把音效作为独立文件再分发、转售，或用于训练 AI 模型。",
      "license_family": "site-free"
    }
  ]
}
