{
  "category": "Mockups & Design Templates",
  "category_zh": "样机与设计模板",
  "slug": "mockups-templates",
  "description": "PSD/device mockups, thumbnail and social media templates.",
  "description_zh": "PSD/设备样机、封面图与社交媒体模板。",
  "entries": [
    {
      "name": "Mockup World",
      "url": "https://www.mockupworld.co/",
      "description": "Aggregator of free photorealistic PSD mockups from across the web.",
      "description_zh": "全网免费逼真 PSD 样机聚合站。",
      "license": "Various (per item)",
      "license_family": "mixed",
      "attribution": "varies",
      "monetization": "varies",
      "signup": "not-required"
    },
    {
      "name": "GraphicsFuel",
      "url": "https://www.graphicsfuel.com/",
      "description": "Free high-resolution PSD mockups and design templates.",
      "description_zh": "免费高分辨率 PSD 样机与设计模板。",
      "license": "Various (per item)",
      "license_family": "mixed",
      "attribution": "varies",
      "monetization": "varies",
      "signup": "not-required",
      "notes": "Check the license note on each download page.",
      "notes_zh": "以下载页标注的许可为准。"
    },
    {
      "name": "ls.graphics Free Mockups",
      "url": "https://www.ls.graphics/free-mockups",
      "description": "High-quality free device and scene mockups from a premium shop.",
      "description_zh": "高端商店的免费高质量设备与场景样机。",
      "license": "ls.graphics Free License",
      "license_family": "site-free",
      "attribution": "not-required",
      "monetization": "allowed",
      "signup": "not-required",
      "linkcheck_js": true
    },
    {
      "name": "Pixelbuddha Free",
      "url": "https://pixelbuddha.net/free",
      "description": "Free design resources: mockups, icons, UI kits.",
      "description_zh": "免费设计资源：样机、图标、UI 套件。",
      "license": "Various (per item)",
      "license_family": "mixed",
      "attribution": "varies",
      "monetization": "varies",
      "signup": "required",
      "notes": "Free downloads need a free account; the $10/mo Plus tier is the unlimited option, not a gate on the free files.",
      "notes_zh": "下载免费素材需先注册免费账号；$10/月的 Plus 是无限下载档，并非免费文件的门槛。"
    },
    {
      "name": "Canva Templates",
      "url": "https://www.canva.com/templates/",
      "description": "Free templates for thumbnails, posts, decks and shorts.",
      "description_zh": "免费模板：封面图、帖子、演示文稿与短视频。",
      "license": "Canva Content License",
      "license_family": "site-free",
      "attribution": "not-required",
      "monetization": "conditional",
      "signup": "required",
      "notes": "Canva content has resale and redistribution restrictions; read the Content License.",
      "notes_zh": "Canva 素材有转售与再分发限制；请阅读内容许可。"
    },
    {
      "name": "Adobe Express Templates",
      "url": "https://www.adobe.com/express/templates",
      "description": "Free templates for social media graphics and branding.",
      "description_zh": "免费的社媒图形与品牌模板。",
      "license": "Adobe Stock/Express License",
      "license_family": "site-free",
      "attribution": "not-required",
      "monetization": "conditional",
      "signup": "required"
    },
    {
      "name": "Smartmockups",
      "url": "https://www.canva.com/mockups/",
      "description": "Browser-based mockup generator with free templates, now under Canva.",
      "description_zh": "浏览器样机生成器，含免费模板（Canva 旗下）。",
      "license": "Smartmockups Free License",
      "license_family": "site-free",
      "attribution": "not-required",
      "monetization": "conditional",
      "signup": "required",
      "notes": "Free tier limits resolution and template count.",
      "notes_zh": "免费档限制分辨率与模板数量。"
    },
    {
      "name": "Pixeden",
      "url": "https://www.pixeden.com/",
      "description": "Free PSD mockups, graphics and web design resources.",
      "description_zh": "免费 PSD 样机、图形与网页设计资源。",
      "license": "Pixeden License (per item)",
      "license_family": "mixed",
      "attribution": "varies",
      "monetization": "varies",
      "signup": "optional",
      "notes": "Check the license note on each free item page.",
      "notes_zh": "免费条目以下载页许可说明为准。"
    },
    {
      "name": "HTML5 UP",
      "url": "https://html5up.net/",
      "description": "Sleek, fully responsive HTML5 site templates by AJ.",
      "description_zh": "AJ 制作的精美全响应式 HTML5 网站模板。",
      "license": "CC BY 3.0",
      "license_family": "cc-by",
      "attribution": "required",
      "monetization": "allowed",
      "signup": "not-required",
      "notes": "CC BY 3.0: credit HTML5 UP for the design. Attribution-free versions are sold via the author's Pixelarity.",
      "notes_zh": "CC BY 3.0：需为设计署名 HTML5 UP；作者的 Pixelarity 提供免署名版本。"
    },
    {
      "name": "Start Bootstrap",
      "url": "https://startbootstrap.com/",
      "description": "Free MIT-licensed Bootstrap themes, templates and snippets.",
      "description_zh": "MIT 许可的免费 Bootstrap 主题、模板与代码片段。",
      "license": "MIT",
      "license_family": "permissive",
      "attribution": "not-required",
      "monetization": "allowed",
      "signup": "not-required"
    },
    {
      "name": "SlidesCarnival",
      "url": "https://www.slidescarnival.com/",
      "description": "Free presentation templates for PowerPoint and Google Slides.",
      "description_zh": "免费的 PowerPoint / Google Slides 演示模板。",
      "license": "Various (per template)",
      "license_family": "mixed",
      "attribution": "varies",
      "monetization": "varies",
      "signup": "not-required",
      "notes": "Most templates are free for commercial use; check each template's license note.",
      "notes_zh": "多数模板可免费商用；以每个模板的许可说明为准。"
    },
    {
      "name": "GraphicBurger",
      "url": "https://graphicburger.com/",
      "description": "Mockups, UI kits and design resources; royalty-free for personal and commercial work, no attribution.",
      "description_zh": "样机、UI 套件与设计资源；个人与商业项目均可免费使用，免署名。",
      "license": "GraphicBurger free license",
      "license_family": "site-free",
      "attribution": "not-required",
      "monetization": "allowed",
      "signup": "not-required",
      "notes": "License page allows unlimited personal/commercial projects with no credit; reselling the resources themselves is prohibited.",
      "notes_zh": "许可页允许不限量商用且无需署名；禁止转售资源本身。"
    }
  ]
}
